Name,AI Type,Commercial Type,Product,Description,Product Category,Package,Quick Filters,Availability,Identifier,Detail Page
"Process Generation","AI Feature","Base","SAP Build Process Automation","Generate process artifacts from natural language to support process automation.","Technology Platform","","","Generally Available","J638","https://discovery-center.cloud.sap/ai-feature/50a434ab-f63c-4f3f-a5d2-c661b5d461f2/"
"Process Modeler","AI Feature","Premium","SAP Signavio solutions","Generate a BPMN diagram from a text description or image of a business process.","Business Transformation Management","","","Generally Available","J213","https://discovery-center.cloud.sap/ai-feature/84eb743d-acdb-48ff-b933-ec51fe9f5f12/"
"Process Recommender","AI Feature","Premium","SAP Signavio solutions","Get instant best practice recommendations.","Business Transformation Management","","Joule","Generally Available","J121","https://discovery-center.cloud.sap/ai-feature/0568e3e9-bef3-46d5-8b51-f519d8838320/"
"Process Summarization","AI Feature","Base","SAP Build Process Automation","Generate business summaries for undocumented process models.","Technology Platform","","","Generally Available","J640","https://discovery-center.cloud.sap/ai-feature/69b0874a-e8a6-49e3-b66c-4a6c5b1fd77f/"
"Processing of Incoming Quality Certificates with SAP Document AI","AI Feature","Premium","SAP S/4HANA Cloud Public Edition","Automatically process incoming quality certificate documents.","Cloud ERP applications","","","Generally Available","J358","https://discovery-center.cloud.sap/ai-feature/3fd5ea00-34fa-487e-a76a-be112a71220a/"
"Processing of Payment Advices with SAP Document AI","AI Feature","Premium","SAP S/4HANA Cloud Public Edition","Automate payment-advice processing to reduce errors and manual fixes.","Cloud ERP applications","","","Generally Available","J1104","https://discovery-center.cloud.sap/ai-feature/988b6b7c-ac4f-4c5f-be46-0366c7dc5a2e/"
"Product Descriptions","AI Feature","Premium","SAP CX AI Toolkit","Create personalized product descriptions that enrich your catalog data.","Customer Relationship Management","Joule Premium for Customer Experience","Joule","Generally Available","J11","https://discovery-center.cloud.sap/ai-feature/26ba4bf2-a78e-444c-ab9f-99ff2df5ee3e/"
"Product Finder","AI Feature","Premium","SAP Engagement Cloud","Find and insert products into emails using AI-powered search.","Customer Relationship Management","Joule Premium for Customer Experience","","Generally Available","J361","https://discovery-center.cloud.sap/ai-feature/d8cc96bf-328c-4990-90e4-f8b40531cd0d/"
"Product Recommendation","AI Feature","Base","SAP Sales Cloud Version 2","Make quick upselling offers to customers.","Customer Relationship Management","","","Generally Available","J800","https://discovery-center.cloud.sap/ai-feature/05abefb4-3b91-4fb0-8066-d0015c614c57/"
"Product Recommendations","AI Feature","Base","SAP Assortment Planning","Get system-generated product recommendations for your assortment.","Customer Relationship Management","","","Generally Available","J812","https://discovery-center.cloud.sap/ai-feature/1f5b7c78-b43f-468c-b577-934a6d89447e/"
"Product Recommendations","AI Feature","Base","Intelligent Selling Services for SAP Commerce Cloud","Show visitors the right products at the right time in their shopping journey.","Customer Relationship Management","","","Generally Available","J805","https://discovery-center.cloud.sap/ai-feature/07502ba4-aca2-405a-99f2-671d9c4ff94a/"
"Product Slotting","AI Feature","Base","SAP Extended Warehouse Management","Determine product attributes for new products in the warehouse.","Supply Chain Management","","","Generally Available","J857","https://discovery-center.cloud.sap/ai-feature/dcc6b99e-4545-40bc-beef-fd85272062d7/"
"Product Tagging","AI Feature","Premium","SAP CX AI Toolkit","Extract and enrich your product tags with AI.","Customer Relationship Management","Joule Premium for Customer Experience","","Generally Available","J12","https://discovery-center.cloud.sap/ai-feature/f68c60a5-ac32-4124-80dd-7b9dc1258061/"
"Production Engineering","AI Feature","","SAP Digital Manufacturing","Setup and manage production processes efficiently.","Supply Chain Management","","","Beta","J611","https://discovery-center.cloud.sap/ai-feature/559401aa-0738-4448-b3cb-96d75802e463/"
"Production Planning and Operations Agent","AI Agent","","","Accelerate order-to-delivery by releasing orders in half the time.","Cloud ERP applications","","Joule","Beta","J383","https://discovery-center.cloud.sap/ai-feature/2bac78a3-811f-456f-b950-a4fb3e7d2ac5/"
"Profanity Check","AI Feature","Base","SAP Enterprise Service Management","Define a set of pejorative vocabulary.","Customer Relationship Management","","","Generally Available","J816","https://discovery-center.cloud.sap/ai-feature/4db1437d-b807-4305-8f31-26815af1b898/"
"Profanity Check","AI Feature","Base","SAP Service Cloud Version 2","Define a set of pejorative vocabulary.","Customer Relationship Management","","","Generally Available","J794","https://discovery-center.cloud.sap/ai-feature/7d48b7ea-dde6-40fe-a257-5cad59a19fee/"
"Project Services","AI Feature","Base","SAP S/4HANA Cloud Public Edition","Manages project tasks through a conversational interface.","Cloud ERP applications","","Joule","Generally Available","J586","https://discovery-center.cloud.sap/ai-feature/bccabd59-564e-4a4d-84b3-67d6933348cd/"
"Project Setup Agent","AI Agent","","","Help project managers quickly set up projects using past project data.","Cloud ERP applications","","New","Beta","J872","https://discovery-center.cloud.sap/ai-feature/49c08b5c-583b-4108-ba23-401c3da051cf/"
"Q&A Agent","AI Agent","Premium","","Autonomously process and answer questions from existing customer data.","Customer Relationship Management","Joule Premium for Customer Experience","Featured","Generally Available","J939","https://discovery-center.cloud.sap/ai-feature/8babb1dd-2669-44d4-879e-32d86033a40d/"
"Quote Creation Agent","AI Agent","Premium","","Automate quote generation in SAP Cloud for Customer.","Customer Relationship Management","Joule Premium for Customer Experience","Featured","Generally Available","J657","https://discovery-center.cloud.sap/ai-feature/915726b6-d078-4d9a-bf0b-fb3e7b323335/"
"Receipt Analysis Agent","AI Agent","Base","","ExpenseIt powered by Receipt Analysis Agent accurately extracts receipt data.","Spend Management","","","Early Adopter Care (EAC)","J882","https://discovery-center.cloud.sap/ai-feature/2874809e-283f-4c8e-80d4-cadc7d49e76d/"
"Recommended Material Groups","AI Feature","Base","SAP Ariba Buying","Get material group recommendations based on product name and description.","Spend Management","","","Generally Available","J808","https://discovery-center.cloud.sap/ai-feature/137007a4-ec25-47ab-8ee8-25770f505bf0/"
"Registered Product Summary","AI Feature","Premium","SAP Service Cloud Version 2","Generate registered product summaries.","Customer Relationship Management","Joule Premium for Customer Experience","","Generally Available","J789","https://discovery-center.cloud.sap/ai-feature/0455ae3c-38bc-4b0c-b9a6-c6a08f0ed64e/"
"Report Builder","AI Feature","Base","SAP Engagement Cloud","Flexible reporting with generative AI.","Customer Relationship Management","","","Generally Available","J537","https://discovery-center.cloud.sap/ai-feature/e398c338-0149-4add-8469-accbf9115416/"
"Request Assistant","AI Feature","Base","Concur Request","Estimate costs when planning business trips.","Spend Management","","","Generally Available","J101","https://discovery-center.cloud.sap/ai-feature/04b097c6-f18c-4ae0-a869-6c0736ec5e7f/"
"Requirement Generation","AI Feature","Premium","SAP Cloud ALM","Generate requirements from meeting notes to improve Fit-to-Standard workshops.","Technology Platform","","","Generally Available","J778","https://discovery-center.cloud.sap/ai-feature/e5701d25-2615-49ad-acf3-4f2a6363a206/"
"Requirements Model Creation","AI Feature","Base","SAP Integrated Product Development","Create requirement models with natural language.","Supply Chain Management","","Joule","Generally Available","J983","https://discovery-center.cloud.sap/ai-feature/897e0a14-4ff8-4907-abcc-79c39b4290c8/"
"Requirements Processing","AI Feature","Premium","SAP Intelligent Product Recommendation","Extract needs from unstructured text description of customer requirements.","Customer Relationship Management","Joule Premium for Financial Management","Featured","Generally Available","J59","https://discovery-center.cloud.sap/ai-feature/875f25ea-0abb-47e9-99b4-8722c17aa55d/"
"Resolution of Implausible Meter Readings","AI Feature","Base","SAP S/4HANA Cloud Private Edition","Enables machine learning-based processing of implausible meter readings in IS-U.","Cloud ERP applications","","","Generally Available","J824","https://discovery-center.cloud.sap/ai-feature/4d67f2b1-6f72-4c6f-bce3-e6d4c0e89b1c/"
"Resolution of Outsorted Billing Documents","AI Feature","Base","SAP S/4HANA Cloud Private Edition","Process outsorted billing documents in IS-U.","Cloud ERP applications","","","Generally Available","J825","https://discovery-center.cloud.sap/ai-feature/f9a4201e-955f-4aaf-b41a-d2479fb13ed1/"
"Resume Assessment","AI Feature","Base","SAP Fieldglass Contingent Workforce Management","Evaluate how compatible is a job seeker's resume with a job posting.","Spend Management","","","Generally Available","J847","https://discovery-center.cloud.sap/ai-feature/39cbb1de-26fb-4412-8d09-344a26cdf689/"
"Retrieval of Equipment Information in Service Management","AI Feature","Premium","SAP S/4HANA Cloud Private Edition","Give service managers a 360° view of service history on customer equipment.","Cloud ERP applications","Joule Premium for Supply Chain Management","Joule","Generally Available","J777","https://discovery-center.cloud.sap/ai-feature/3de36a16-73ca-4df6-94d2-ccd0dc806192/"
"Role-based Process Overview","AI Feature","","SAP Signavio Process Collaboration Hub","Get a personalized view of key processes‚ tools‚ and content for your role.","Business Transformation Management","","","Beta","J331","https://discovery-center.cloud.sap/ai-feature/e4b92ea3-f81d-4f95-9afd-368b563700ad/"
"Run Forecasts in Time Series or Line Charts","AI Feature","Base","SAP Analytics Cloud","Automatically predict future data values in stories time series and line charts.","Technology Platform","","","Generally Available","J885","https://discovery-center.cloud.sap/ai-feature/6ddc1967-60b4-4d85-b50e-121f4589d27e/"
"Safety Instruction Generation","AI Feature","","SAP S/4HANA Cloud Public Edition","Generate safety instructions grounded on risk assessments.","Cloud ERP applications","","","Beta","J756","https://discovery-center.cloud.sap/ai-feature/76d64fc7-204e-4a1f-979c-2a75a7a4ce29/"
"Safety Observation Reporting","AI Feature","","SAP S/4HANA Cloud Public Edition","Enable users to report safety observations with natural language.","Cloud ERP applications","","Joule","Beta","J596","https://discovery-center.cloud.sap/ai-feature/c3691d08-1455-4c6a-8cea-e524489e5b69/"
"Sales Order Automatic Completion","AI Feature","Base","SAP S/4HANA Cloud Public Edition","Streamline sales order completion with recommendations.","Cloud ERP applications","","","Generally Available","J43","https://discovery-center.cloud.sap/ai-feature/39a49e49-3ab6-46f5-889d-2035d9378cab/"
"Sales Order Creation","AI Feature","Base","SAP S/4HANA","Create sales orders from unstructured data.","Cloud ERP applications","","","Generally Available","J846","https://discovery-center.cloud.sap/ai-feature/451531fc-438b-4ecd-a3be-3efb74cb99f5/"
"Sales Order Creation","AI Feature","Base","SAP S/4HANA Cloud Public Edition","Create sales orders from unstructured data.","Cloud ERP applications","","","Generally Available","J831","https://discovery-center.cloud.sap/ai-feature/5d3d1312-92d7-478a-8e95-f0f0130f5666/"
"Sales Order Creation","AI Feature","Base","SAP S/4HANA Cloud Private Edition","Create sales orders from unstructured data.","Cloud ERP applications","","","Generally Available","J832","https://discovery-center.cloud.sap/ai-feature/836b7ca4-0177-4757-8152-51846c586f1e/"
"Sales Order Creation from Unstructured Data","AI Feature","Premium","SAP S/4HANA Cloud Public Edition","Seamlessly create sales orders from unstructured data.","Cloud ERP applications","","","Generally Available","J404","https://discovery-center.cloud.sap/ai-feature/ffd1d0b2-76fc-4e1f-b1fd-523ec82bae54/"
"Sales Order Fulfillment Monitoring","AI Feature","Premium","SAP S/4HANA Cloud Private Edition","Monitor and resolve order fulfillment issues with AI.","Cloud ERP applications","Joule Premium for Financial Management","Joule","Generally Available","J169","https://discovery-center.cloud.sap/ai-feature/16fe0c99-25ff-48e2-81e5-f100d4c64767/"
"Sales Order Status Check","AI Feature","Base","SAP S/4HANA Cloud Public Edition","Track sales order fulfillment and spot issues blocking completion.","Financial Management","","Joule","Generally Available","J1047","https://discovery-center.cloud.sap/ai-feature/8e12da05-b0e4-490f-9cf4-0cc2a9482f71/"
"Sales Order Summary","AI Feature","Premium","SAP Sales Cloud Version 2","Analyze and present insights from pricing simulations in sales orders.","Customer Relationship Management","Joule Premium for Customer Experience","","Generally Available","J758","https://discovery-center.cloud.sap/ai-feature/86ea8564-93d1-49b7-af83-896e5e3f20a2/"
"SAP Document AI‚ embedded edition","AI Feature","Premium","SAP SuccessFactors solutions","Automated data extraction and import from uploaded National ID documents.","Human Capital Management","","","Generally Available","J1076","https://discovery-center.cloud.sap/ai-feature/81fc725e-d4e3-4df1-a46d-085c2f2e0fb1/"
"SAP HANA application migration","AI Feature","Base","SAP HANA Cloud","Automate SAP HANA XS/XSA service layer migration to SAP CAP using GenAI.","Technology Platform","","","Generally Available","J180","https://discovery-center.cloud.sap/ai-feature/14bbef6b-5d85-4221-bd0e-342f569ef628/"
"SAP Joule action bar (On-Demand)","AI Feature","Premium","WalkMe","An intelligent overlay that delivers AI on any application - SAP and beyond.","Technology Platform","","Joule","Early Adopter Care (EAC)","J1054","https://discovery-center.cloud.sap/ai-feature/4f879550-f761-4e34-a13e-e55088257d82/"
"SAP Joule action bar (Proactive)","AI Feature","Premium","WalkMe","An intelligent overlay that delivers AI on any application - SAP and beyond.","Technology Platform","","Joule","Early Adopter Care (EAC)","J1019","https://discovery-center.cloud.sap/ai-feature/39a63888-9e1a-46b7-b669-aab32195f8fa/"
"SAP Joule for Consultants","AI Feature","Premium","SAP Joule for Consultants","Accelerate SAP projects and cloud transformations with AI assistance.","Technology Platform","SAP Joule for Consultants","Featured‚Joule","Generally Available","J146","https://discovery-center.cloud.sap/ai-feature/3c3c6f7d-7310-47a9-ae52-d7ddd2f0c2f2/"
"Screen Guide Agent","AI Agent","","","Accelerate understanding and adoption of SAP Signavio","Business Transformation Management","","Joule","Beta","J1130","https://discovery-center.cloud.sap/ai-feature/1be89884-5087-4293-9b9e-da35987fe9bc/"
"Script Optimization","AI Feature","Base","SAP Integration Suite","Optimize custom scripts effortlessly.","Technology Platform","","","Generally Available","J147","https://discovery-center.cloud.sap/ai-feature/99357ead-1ee2-4b9d-9b2f-f74d10f09262/"
"Script Task Generation","AI Feature","Base","SAP Build Process Automation","Generate executable JavaScript codes with natural language.","Technology Platform","","","Generally Available","J644","https://discovery-center.cloud.sap/ai-feature/f2310927-98ed-410a-86bb-1ca9ece68e21/"
"Search Term Suggestions","AI Feature","Base","Intelligent Selling Services for SAP Commerce Cloud","Analyzes user search phrases and displays the most popular results.","Customer Relationship Management","","","Generally Available","J806","https://discovery-center.cloud.sap/ai-feature/f89c8657-4f82-42b3-9163-4dfb82484b7a/"
"Semantic Generation","AI Feature","Premium","SAP Datasphere","Generate business semantics for non-SAP data sources.","Technology Platform","","","Generally Available","J329","https://discovery-center.cloud.sap/ai-feature/d22ae902-3e3d-4c78-9f8e-a656ecd2686d/"
"Send Time Optimization","AI Feature","Base","SAP Engagement Cloud","Optimize sending time of your email campaigns.","Customer Relationship Management","","","Generally Available","J839","https://discovery-center.cloud.sap/ai-feature/5ee667c1-5e60-42e5-987a-28a5686cb83f/"
"Sentiment Analysis in 360 Reviews","AI Feature","Premium","SAP SuccessFactors Performance and Goals","Analyze the sentiment of a feedback delivered in a 360 review.","Human Capital Management","Joule Premium for Human Capital Management","","Generally Available","J268","https://discovery-center.cloud.sap/ai-feature/fbff7183-4055-4a73-ba53-a19ff4ece39f/"
"Shopping Agent","AI Agent","Premium","","Transform your online shopping experience with an AI shopping agent.","Customer Relationship Management","","Featured‚Joule","Generally Available","J278","https://discovery-center.cloud.sap/ai-feature/a106376a-e832-4ee5-a8cc-3e2cc0c64ecc/"
"Similar Case Recommendation","AI Feature","Base","SAP Enterprise Service Management","Find solutions from similar cases from the past and apply to the current case.","Customer Relationship Management","","","Generally Available","J802","https://discovery-center.cloud.sap/ai-feature/4ed5f9f0-3521-4250-ab1e-066de78c7db1/"
"Similar Case Recommendation","AI Feature","Base","SAP Service Cloud Version 2","Find solutions from previous similar cases that can be applied to your case.","Customer Relationship Management","","","Generally Available","J851","https://discovery-center.cloud.sap/ai-feature/ce71187b-3bb2-4771-9105-c6a220b66783/"
"Skill Based Job Posting","AI Feature","Base","SAP Fieldglass Contingent Workforce Management","AI-powered skill-based hiring for faster‚ smarter talent matching.","Spend Management","","","Generally Available","J282","https://discovery-center.cloud.sap/ai-feature/65d27c45-c084-4ac6-af73-13eeeeb8eb37/"
"Skill Builder","AI Feature","Base","Joule Studio","Extend Joule with skills that fit your unique needs.","Technology Platform","","Featured‚Joule","Generally Available","J195","https://discovery-center.cloud.sap/ai-feature/e93aa292-e7f4-449d-9586-f1a8510d5ab6/"
"Skill Identification from Resume","AI Feature","Premium","SAP SuccessFactors solutions","Identify skills from a resume and display the skills on the Growth Portfolio.","Human Capital Management","Joule Premium for Human Capital Management","","Generally Available","J1058","https://discovery-center.cloud.sap/ai-feature/653d712b-c53c-4f46-a75f-b3235313373c/"
"Skill Inference for Assignment Creation","AI Feature","Premium","SAP SuccessFactors Opportunity Marketplace","Create and edit assignments using generative AI.","Human Capital Management","Joule Premium for Human Capital Management","","Generally Available","J769","https://discovery-center.cloud.sap/ai-feature/19be382b-8169-4310-8365-b8b2e7f88c2d/"
"Skill Inference for Continuous Performance Mgmt","AI Feature","Premium","SAP SuccessFactors Performance and Goals","Infer skills to employees using Continuous Performance Management data.","Human Capital Management","Joule Premium for Human Capital Management","","Generally Available","J772","https://discovery-center.cloud.sap/ai-feature/0b01a305-b10b-4891-82ad-7be208aadf7b/"
"Skill Inference for Learning","AI Feature","Premium","SAP SuccessFactors Learning","Associate skills with learning items in bulk through the import process.","Human Capital Management","Joule Premium for Human Capital Management","","Generally Available","J774","https://discovery-center.cloud.sap/ai-feature/b06f79b0-a8f9-45da-8303-8c112128e444/"
"Skills Architecture Creation","AI Feature","Premium","SAP SuccessFactors solutions","Create an AI-based skills library from job profiles.","Human Capital Management","Joule Premium for Human Capital Management","","Generally Available","J64","https://discovery-center.cloud.sap/ai-feature/4fb112d7-8daf-4a5f-9a7c-d132c129b193/"
"Skills Inference for Open Content Network","AI Feature","Base","SAP SuccessFactors Learning","Associate skills with Open Content Network (OCN) items.","Human Capital Management","","","Generally Available","J771","https://discovery-center.cloud.sap/ai-feature/9d527a11-ada5-466b-95d0-6a3e30ee8543/"
"Skills Standardization","AI Feature","Base","SAP SuccessFactors solutions","Use the industry-standard skill names in the Attributes Library.","Human Capital Management","","","Generally Available","J770","https://discovery-center.cloud.sap/ai-feature/a2a77a5f-3ce0-4257-bbac-51de82b90f91/"
"Smart Actions","AI Feature","Premium","SAP CX AI Toolkit","Proactive AI Insights for your emails‚ meetings‚ and more.","Customer Relationship Management","Joule Premium for Customer Experience","Joule","Generally Available","J15","https://discovery-center.cloud.sap/ai-feature/c5a858eb-0f2c-4b03-abc2-cccdc2eab814/"
"Smart Grouping","AI Feature","Base","SAP Analytics Cloud","ML clustering‚ groups similar data points in scatter and bubble charts.","Technology Platform","","","Generally Available","J892","https://discovery-center.cloud.sap/ai-feature/793c4da0-4886-4ee0-9c53-0bc2c465a624/"
"Smart Insights","AI Feature","Base","SAP Analytics Cloud","Smart Insights analyzes data deviations‚ providing insights as text and visuals.","Technology Platform","","","Generally Available","J886","https://discovery-center.cloud.sap/ai-feature/9ff17406-6da6-4066-bbb7-2edb8d898dbd/"
"Smart Personalization of My Home","AI Feature","Premium","SAP S/4HANA Cloud Public Edition","Personalize your home page by adding insights cards.","Financial Management","Joule Premium for Financial Management","","Generally Available","J226","https://discovery-center.cloud.sap/ai-feature/5205d1ac-b2a1-413b-8d5c-a01e22311cad/"
"Smart Personalization of My Home for Applications","AI Feature","Premium","SAP S/4HANA Cloud Public Edition","Personalize your home page by adding apps.","Financial Management","Joule Premium for Financial Management","","Generally Available","J934","https://discovery-center.cloud.sap/ai-feature/2b5df257-bdfd-4396-a48b-a8362b2e02f7/"
"Smart Predict","AI Feature","Base","SAP Analytics Cloud","Create predictive models‚ deliver accurate predictions for analytics & planning.","Technology Platform","","","Generally Available","J893","https://discovery-center.cloud.sap/ai-feature/3e3dbf93-52e2-4a08-b6f3-58b7396bc445/"
"Smart Scheduling","AI Feature","Premium","SAP CX AI Toolkit","Streamline and optimize your calendar management.","Customer Relationship Management","Joule Premium for Customer Experience","Joule","Generally Available","J16","https://discovery-center.cloud.sap/ai-feature/95c190b5-0576-4ec8-afd1-5454d0329702/"
"Smart Solution for Situations in My Home","AI Feature","","SAP S/4HANA Cloud Public Edition","Provide resolution suggestions directly on the homepage.","Financial Management","","","Beta","J181","https://discovery-center.cloud.sap/ai-feature/5a6f7a49-1bbf-4e9b-b2e0-57aad5f2de6d/"
"Smart Summarization","AI Feature","Base","SAP S/4HANA Cloud Public Edition","Jump start your communications or follow-ups by generated text proposals.","Financial Management","","","Generally Available","J90","https://discovery-center.cloud.sap/ai-feature/a66caf9e-90e0-44c3-9f4a-47aa40f6027b/"
"Sourcing Agent","AI Agent","","","Run smarter sourcing events faster and with less effort.","Spend Management","","Featured‚Joule","Beta","J415","https://discovery-center.cloud.sap/ai-feature/944d71fe-90ad-4ef9-894c-878a4a326893/"
"SOW Deliverables Creation","AI Feature","Premium","SAP Fieldglass Services Procurement","Create precise and relevant SOW deliverables based on project scope.","Supplier Management","Joule Premium for Spend Management","","Generally Available","J499","https://discovery-center.cloud.sap/ai-feature/ab95fb1c-6563-45f3-81c3-97e2ae526950/"
"SOW Description Creation","AI Feature","Premium","SAP Fieldglass Services Procurement","Simplify SOW collaboration with AI-enhanced descriptions.","Spend Management","Joule Premium for Spend Management","","Generally Available","J77","https://discovery-center.cloud.sap/ai-feature/05a8ad20-8b56-4279-85ac-94136f8cc4d3/"
"Spend Categorization","AI Feature","Base","SAP Spend Control Tower","Automatically predict UNSPSC hierarchy from spend data using FFN classification.","Technology Platform","","","Generally Available","J155","https://discovery-center.cloud.sap/ai-feature/0c83b1a0-0b73-413a-ae04-4017e4b82a83/"
"Standard Tools","AI Feature","Premium","SAP CX AI Toolkit","Role specific prompts utilizing CX data to generate discovery questions etc.","Customer Relationship Management","Joule Premium for Customer Experience","Joule","Generally Available","J56","https://discovery-center.cloud.sap/ai-feature/7c97317c-5b65-48d4-9288-540f6aca8e8d/"
"Strategy Summarizer","AI Feature","Premium","SAP Ariba Category Management","Generate summaries of category strategy documents.","Spend Management","Joule Premium for Spend Management","","Generally Available","J605","https://discovery-center.cloud.sap/ai-feature/e5329885-d1a9-4fbe-97cd-eea7e62b70c4/"
"Subject Line Generator","AI Feature","Base","SAP Engagement Cloud","Context-driven generation of email subject lines.","Customer Relationship Management","","Featured","Generally Available","J20","https://discovery-center.cloud.sap/ai-feature/69ff31b4-d15f-4b9e-b485-3b9cc3116550/"
