Name,AI Type,Commercial Type,Product,Description,Product Category,Package,Quick Filters,Availability,Identifier,Detail Page
"Data Anonymization","AI Feature","Base","SAP Data Privacy Integration","Anonymize unstructured data such as free text‚ text files‚ and images.","Technology Platform","","","Generally Available","J80","https://discovery-center.cloud.sap/ai-feature/809faf14-e4ef-47e0-abd4-2b51f7500892/"
"Database Administration","AI Feature","Base","SAP HANA Cloud","AI-powered tool for task simplification and efficiency enhancement.","Technology Platform","","Joule","Generally Available","J214","https://discovery-center.cloud.sap/ai-feature/28b14ec8-e7be-4966-b33e-787021b2d05d/"
"Deal Intelligence","AI Feature","Base","SAP Sales Cloud Version 2","Predict if an opportunity can be won or lost.","Customer Relationship Management","","","Generally Available","J795","https://discovery-center.cloud.sap/ai-feature/57ace435-bf2c-4749-b628-523d40ed2e09/"
"Decision Generation","AI Feature","Base","SAP Build Process Automation","Assist process design by generating decision artifacts.","Technology Platform","","","Generally Available","J642","https://discovery-center.cloud.sap/ai-feature/0517fabc-df67-4042-9015-a57c1a9079ba/"
"Decision Summarization","AI Feature","Base","SAP Build Process Automation","Assist users with process automation design by summarizing undocumented rules.","Technology Platform","","","Generally Available","J643","https://discovery-center.cloud.sap/ai-feature/d9b9af67-e0a9-49cc-b79b-a8eddde1731b/"
"Declaration Image Analysis","AI Feature","","SAP Green Token","Automatically extract information from declarations of different formats.","Supply Chain Management","","","Beta","J173","https://discovery-center.cloud.sap/ai-feature/ef9efdef-7300-4580-9c54-5664e1c99f95/"
"Deep Research Capability","AI Feature","","Joule","Get tailored business insights combining internal SAP and external web data.","Technology Platform","","Joule","Beta","J1173","https://discovery-center.cloud.sap/ai-feature/0cbab727-02fe-47d3-9bf1-ff96d6c2ae62/"
"Demand Intake","AI Feature","Base","SAP Ariba Intake Management","Natural language queries to route queries to correct intake process.","Spend Management","","","Generally Available","J948","https://discovery-center.cloud.sap/ai-feature/3e7d54f8-2981-45bf-b528-b432b0d1b855/"
"Demand Sensing","AI Feature","Base","SAP Integrated Business Planning","Create optimized daily forecasts for multiple products based on demand.","Supply Chain Management","","","Generally Available","J817","https://discovery-center.cloud.sap/ai-feature/08b50280-d6f0-4731-ba50-a6faa578f9d8/"
"Depreciation Key Explanation","AI Feature","Premium","SAP S/4HANA Cloud Private Edition","Explain depreciation types and calculation procedures in natural language.","Cloud ERP applications","Joule Premium for Financial Management","","Generally Available","J898","https://discovery-center.cloud.sap/ai-feature/7f81035d-7177-494f-b232-b1e290c05f0c/"
"Development Goal Creation","AI Feature","Premium","SAP SuccessFactors Performance and Goals","Build meaningful and inspiring development goals.","Human Capital Management","Joule Premium for Human Capital Management","","Generally Available","J37","https://discovery-center.cloud.sap/ai-feature/ef16dd9e-a2db-44df-bb8b-23b16c68bd88/"
"Digital Service Agent","AI Agent","Premium","","Enhance CX with swift‚ informed‚ and knowledge-based support.","Customer Relationship Management","","","Generally Available","J663","https://discovery-center.cloud.sap/ai-feature/9bd66628-12f0-46f7-b9d7-ce4ff725a946/"
"Dispute Resolution Agent","AI Agent","","","Automates the process of resolving disputes about incorrect invoices.","Financial Management","","Featured‚Joule","Beta","J855","https://discovery-center.cloud.sap/ai-feature/bbf06e89-a47a-4a80-a619-97fa7ba6af92/"
"Dispute Resolution Agent","AI Agent","Premium","","Automates the process of resolving disputes about incorrect invoices.","Cloud ERP applications","","New‚Joule","Beta","J1043","https://discovery-center.cloud.sap/ai-feature/d3a94887-d357-4620-98d5-784a035f9e41/"
"Document Data Extraction","AI Feature","Base","SAP Build Process Automation","Extract and process document data from PDFs and images using AI.","Technology Platform","","","Generally Available","J1284","https://discovery-center.cloud.sap/ai-feature/577af53b-83ac-4c49-8b02-72114d45ceb6/"
"Document Grounding","AI Feature","Premium","","Add context to Joule Q&A using information retrieved from custom documents.","Technology Platform","","Joule","Generally Available","J73","https://discovery-center.cloud.sap/ai-feature/fedeca14-3e69-472c-a0ea-82396735c35f/"
"Document Processing","AI Feature","Base","SAP Self-Billing Cockpit","Extract invoice data from files to automate billing in SAP Self-Billing Cockpit.","Financial Management","","","Generally Available","J1048","https://discovery-center.cloud.sap/ai-feature/70e0fc04-7346-405a-a385-5ad137f11ff3/"
"Document Summary","AI Feature","Base","SAP Integrated Product Development","Summarize complex engineering documents for faster insights and decision making.","Supply Chain Management","","Joule","Generally Available","J194","https://discovery-center.cloud.sap/ai-feature/e8f27a24-5dcd-4b3d-a3db-5c246fde9da5/"
"Duplicate Detection","AI Feature","Premium","SAP Sales Cloud Version 2","Detect duplicate accounts automatically.","Customer Relationship Management","Joule Premium for Customer Experience","","Generally Available","J187","https://discovery-center.cloud.sap/ai-feature/9de7582d-870d-4802-a4ec-90429c6922a5/"
"Duplicate Detection","AI Feature","Premium","SAP Service Cloud Version 2","Detect duplicate accounts automatically.","Customer Relationship Management","Joule Premium for Customer Experience","","Generally Available","J791","https://discovery-center.cloud.sap/ai-feature/fbfe32ee-815b-4543-bab3-fe5376e60d48/"
"E-mail Draft Recommender","AI Feature","Premium","SAP Enterprise Service Management","Generate e-mail drafts based on past interactions via AI.","Customer Relationship Management","","","Generally Available","J21","https://discovery-center.cloud.sap/ai-feature/9aa89525-687f-4c69-8849-a107d366679c/"
"E-mail Draft Recommender","AI Feature","Premium","SAP Sales Cloud Version 2","Reduce time to draft responses based on previous interactions.","Customer Relationship Management","Joule Premium for Customer Experience","Featured","Generally Available","J5","https://discovery-center.cloud.sap/ai-feature/92718e8e-da5f-426d-9561-d53b93671e08/"
"E-mail Draft Recommender","AI Feature","Premium","SAP Service Cloud Version 2","Produce email drafts using AI based on previous exchanges.","Customer Relationship Management","Joule Premium for Customer Experience","","Generally Available","J9","https://discovery-center.cloud.sap/ai-feature/05a916d0-170e-4be2-b60a-a3bc388d383b/"
"Easy Fill","AI Feature","","SAP S/4HANA Cloud Public Edition","Enables users to populate fields of a business object using natural language.","Financial Management","","","Beta","J281","https://discovery-center.cloud.sap/ai-feature/b054b110-d555-49ef-b233-e16be1a13eed/"
"Easy Filter","AI Feature","Base","SAP S/4HANA Cloud Public Edition","Streamline your filtering experience in SAP Fiori elements-based list reports.","Financial Management","","","Generally Available","J91","https://discovery-center.cloud.sap/ai-feature/96cf54f4-566b-4428-916c-1e6231f0fdb2/"
"Electronic Document Error Handling","AI Feature","Base","SAP Document and Reporting Compliance","Get easy-to-understand explanations for electronic document errors with Joule.","Technology Platform","","Joule","Generally Available","J305","https://discovery-center.cloud.sap/ai-feature/1a1b66db-191d-41e6-b01d-d69b4d645850/"
"Embedded Edition","AI Feature","Premium","SAP Document AI","Automate document processing‚ workflow execution‚ and channel integration.","Technology Platform","","Featured","Generally Available","J342","https://discovery-center.cloud.sap/ai-feature/f9000cc5-4a1a-4c59-9dcd-a343c167d75d/"
"Enhanced Responses to Discovery Posting","AI Feature","Base","SAP Business Network for Procurement and Supply Chain","Generate accurate responses to buyers’ request for information.","Supply Chain Management","","","Generally Available","J990","https://discovery-center.cloud.sap/ai-feature/ec7cf891-7318-4583-8468-64ad23d605e3/"
"Enhancement of Campaign and Idea Descriptions","AI Feature","","SAP Integrated Product Development","Enhance campaign ideas and campaign descriptions.","Supply Chain Management","","","Beta","J71","https://discovery-center.cloud.sap/ai-feature/d5113c03-265d-4d5d-a12d-16df0cb4b7c8/"
"Enterprise Search","AI Feature","Base","SAP S/4HANA Cloud Public Edition","Search business data with natural language queries in SAP Fiori Launchpad.","Financial Management","","","Generally Available","J225","https://discovery-center.cloud.sap/ai-feature/ce1359ae-1f44-48ce-b9d8-6d2e73b23402/"
"Entity Extraction​","AI Feature","Premium","SAP Service Cloud Version 2","Identify‚ extract‚ and organize relevant data from business-related content.","Customer Relationship Management","Joule Premium for Customer Experience","","Generally Available","J186","https://discovery-center.cloud.sap/ai-feature/710cb274-8600-4d6c-850e-0912aab35fda/"
"Equipment Insights","AI Feature","Premium","SAP Field Service Management","Generate summary based on previous activities for a piece of equipment.","Supply Chain Management","","","Generally Available","J61","https://discovery-center.cloud.sap/ai-feature/ca488cee-68a8-47d4-885f-d778366b42ca/"
"ERP Configuration for Finance","AI Feature","Base","Concur Invoice","Auto-import and map liability account codes from your accounting system.","Spend Management","","","Generally Available","J701","https://discovery-center.cloud.sap/ai-feature/a366bdbe-3b50-4ea5-9492-8793acf08117/"
"ERP Configuration for Finance","AI Feature","Base","Concur Expense","Auto-import and map liability account codes from your accounting system.","Spend Management","","","Generally Available","J174","https://discovery-center.cloud.sap/ai-feature/f137ecf1-a099-49ab-812b-0b86802d7260/"
"Error Analysis","AI Feature","Premium","SAP Traceability Hub‚ error analysis","Analyze and resolve errors in serialization data exchange.","Technology Platform","","","Generally Available","J283","https://discovery-center.cloud.sap/ai-feature/be8326cc-f24b-4b4b-81fd-f3980762aa32/"
"Error Explanation","AI Feature","Premium","SAP S/4HANA Cloud Public Edition","Generate natural language descriptions and resolutions for error messages.","Financial Management","Joule Premium for Financial Management","","Generally Available","J227","https://discovery-center.cloud.sap/ai-feature/a6e21835-397b-402d-be1a-e92846dcc47d/"
"Error Resolution","AI Feature","","SAP Advanced Financial Closing","Resolve errors identified during financial close processes.","Financial Management","","","Beta","J87","https://discovery-center.cloud.sap/ai-feature/942e1e4b-32e0-480f-9f11-d31badf54186/"
"ESG Report Generation","AI Feature","Premium","SAP Sustainability Control Tower","Generate comprehensive sustainability reports using ESG metrics data.","Financial Management","","","Generally Available","J93","https://discovery-center.cloud.sap/ai-feature/c2b939fa-8655-446c-8d24-81e945c7ecd6/"
"Exception Management","AI Feature","Base","SAP Cell and Gene Therapy Orchestration","Detect exceptions and create alerts for users.","Supply Chain Management","","","Generally Available","J726","https://discovery-center.cloud.sap/ai-feature/72510d2b-ceec-453c-bf75-41eed7a846ae/"
"Expense Report Validation Agent","AI Agent","Base","","Get smart support to minimize errors and simplify expense submission.","Spend Management","","Joule","Early Adopter Care (EAC)","J327","https://discovery-center.cloud.sap/ai-feature/ba618aac-87c8-485d-8d3c-3338f6a8658a/"
"Experience Assessment","AI Feature","Base","SAP Fieldglass Contingent Workforce Management","How closely a job seeker's professional background aligns with a job posting.","Spend Management","","","Generally Available","J849","https://discovery-center.cloud.sap/ai-feature/7a83cedb-25ed-4ed7-af94-3e6cb1d2f85d/"
"Expiring Price Handling","AI Feature","Base","SAP S/4HANA Cloud Public Edition","Quickly detect and update all expiring prices in pricing systems with Joule.","Cloud ERP applications","","Joule","Generally Available","J313","https://discovery-center.cloud.sap/ai-feature/577815a8-947e-4a06-a961-1307ddc49242/"
"Explain Pay","AI Feature","Premium","SAP SuccessFactors Employee Central Payroll","Provide answers and explanations to questions regarding pay using Joule.","Human Capital Management","Joule Premium for Human Capital Management","Joule","Generally Available","J266","https://discovery-center.cloud.sap/ai-feature/49beea9f-592e-413b-9370-e3fb4d3efaec/"
"Explanation of Fixed Asset Depreciation Keys","AI Feature","Premium","SAP S/4HANA Cloud Public Edition","Explain depreciation types and calculation procedures in natural language.","Financial Management","Joule Premium for Financial Management","","Generally Available","J86","https://discovery-center.cloud.sap/ai-feature/15f5b518-2786-4908-953f-801172d7972a/"
"Explanation of Fixed Asset Key Figures","AI Feature","Premium","SAP S/4HANA Cloud Public Edition","Better insights into fixed asset key figures using AI-generated explanations.","Financial Management","Joule Premium for Financial Management","","Generally Available","J288","https://discovery-center.cloud.sap/ai-feature/8658cb4d-fc45-4db1-b5e3-68a63a255955/"
"Extended AI Locales","AI Feature","Premium","SAP SuccessFactors solutions","Review‚ customize‚ and enable AI-translated locales for use.","Human Capital Management","Joule Premium for Human Capital Management","","Generally Available","J766","https://discovery-center.cloud.sap/ai-feature/60772d47-5ec6-4d66-9d41-ae8a2b869996/"
"Failure Curve Analytics","AI Feature","Base","SAP Asset Performance Management","Predict probabilities of failures for technical objects.","Supply Chain Management","","","Generally Available","J823","https://discovery-center.cloud.sap/ai-feature/48add62d-58d0-43f4-adcd-76b404e80eed/"
"Farming Decision Framework","AI Feature","Base","SAP Intelligent Agriculture","Inject farming decision support just-in-time during farming processes.","Technology Platform","","","Generally Available","J835","https://discovery-center.cloud.sap/ai-feature/a8e9c59c-0f89-46ee-8fc9-528bd59ab4e5/"
"Field Service Dispatcher Agent","AI Agent","","","Autonomously schedule and optimize service orders.","Supply Chain Management","","Joule","Beta","J468","https://discovery-center.cloud.sap/ai-feature/9c354ba9-b021-470a-b75d-b6e7bf4405de/"
"Fixed Asset Key Figures Explanation","AI Feature","Base","SAP S/4HANA Cloud Private Edition","Understand the explanation of fixed asset key figures in natural language.","Financial Management","","New","Generally Available","J966","https://discovery-center.cloud.sap/ai-feature/780e16a7-74cf-4118-b200-c13484d2f9b5/"
"Forecast Results Analysis","AI Feature","Premium","SAP Integrated Business Planning","Explain the forecast outcome and recommend ways to improve accuracy.","Supply Chain Management","Joule Premium for Supply Chain Management","","Generally Available","J380","https://discovery-center.cloud.sap/ai-feature/891ed108-7f7b-49f6-99ec-291c2efd18a4/"
"Form Extension in Localization as a Self-Service","AI Feature","Premium","SAP S/4HANA Cloud Public Edition","Extend localized forms to meet your specific requirements.","Financial Management","Joule Premium for Financial Management","","Generally Available","J117","https://discovery-center.cloud.sap/ai-feature/f5f33f40-36d4-4265-b709-461c0c151587/"
"Form Generation","AI Feature","Base","SAP Build Process Automation","Generate process automation forms from natural language descriptions.","Technology Platform","","","Generally Available","J641","https://discovery-center.cloud.sap/ai-feature/ff9ca9a1-b443-405d-95bd-9b53a8a503db/"
"G/L Line-Item Determination","AI Feature","Base","SAP Ariba Invoicing","Auto-enrich and complete draft invoices using historical invoice data.","Spend Management","","","Generally Available","J844","https://discovery-center.cloud.sap/ai-feature/eaf5dcf1-f7aa-4104-8157-d1b72f3881b5/"
"Generation of Full-Stack Applications","AI Feature","Base","SAP Build Code","Generate full-stack applications using natural language in SAP Build Code.","Technology Platform","","Joule","Generally Available","J36","https://discovery-center.cloud.sap/ai-feature/98319fdc-fd0d-4887-bba2-a3d6a15f31ed/"
"Generation of Integrations","AI Feature","Base","SAP Integration Suite","Generate integration scenarios using natural language prompts.","Technology Platform","","","Generally Available","J92","https://discovery-center.cloud.sap/ai-feature/464fdfbe-5809-4a0a-b6e8-65c79033837d/"
"Generation of Operations Automations","AI Feature","Base","SAP Automation Pilot","Generate DevOps and SRE automation flows based on a simple prompt.","Technology Platform","","","Generally Available","J42","https://discovery-center.cloud.sap/ai-feature/be607323-864e-4898-9fe4-0be8f0440d40/"
"Generation of SAP Fiori Elements and SAPUI5 Applications","AI Feature","Base","SAP Build Code","Generate full-stack applications using  natural language in SAP Build Code.","Technology Platform","","Joule","Generally Available","J114","https://discovery-center.cloud.sap/ai-feature/08cc63b7-8fd7-4535-a9d6-f66a9030174c/"
"Generation of SAP HANA Applications","AI Feature","Base","SAP Build Code","Generate SAP HANA applications using natural language in SAP Build Code.","Technology Platform","","Joule","Generally Available","J116","https://discovery-center.cloud.sap/ai-feature/7ee277ac-20af-4458-bb5a-8836d6a51899/"
"Generation of SAP Mobile Applications","AI Feature","Base","SAP Build Code","Generate SAP Mobile applications using natural language in SAP Build Code.","Technology Platform","","Joule","Generally Available","J115","https://discovery-center.cloud.sap/ai-feature/9cd6bb5e-4178-44c2-b5b3-325c561273e4/"
"Goods Receipt Processing","AI Feature","Premium","SAP S/4HANA Cloud Private Edition","Automatically check delivery documents with AI.","Cloud ERP applications","","","Generally Available","J28","https://discovery-center.cloud.sap/ai-feature/8d54e237-4ae9-427d-859a-c3e1cd694127/"
"Hotel Receipt Itemization","AI Feature","Base","Concur Expense","Automatic itemization of hotel receipts.","Spend Management","","","Generally Available","J33","https://discovery-center.cloud.sap/ai-feature/5727f719-99ab-4f95-8a88-221bacf02525/"
"Image Generation","AI Feature","Premium","SAP CX AI Toolkit","Use AI tools for seamless product visual transformation and editing.","Customer Relationship Management","Joule Premium for Customer Experience","","Generally Available","J130","https://discovery-center.cloud.sap/ai-feature/b2f729da-d601-4ad1-a190-5498088b7fad/"
"Image Generation for Learning","AI Feature","Premium","SAP SuccessFactors Learning","Generate images more easily and effectively with AI-assistance.","Human Capital Management","Joule Premium for Human Capital Management","","Generally Available","J265","https://discovery-center.cloud.sap/ai-feature/b56c5f60-17d9-4215-bf06-908e3d8c990d/"
"In-house Service Initiation","AI Feature","Premium","SAP S/4HANA Cloud Private Edition","Initiate in-house services from paper-based information using AI technology.","Cloud ERP applications","Joule Premium for Supply Chain Management","","Generally Available","J240","https://discovery-center.cloud.sap/ai-feature/df0164e9-75f2-4547-80d3-586619709246/"
"Incentive and Payment Insights","AI Feature","Base","SAP Incentive Management","Get quick answers in natural language to incentive management questions.","Customer Relationship Management","","Joule","Early Adopter Care (EAC)","J192","https://discovery-center.cloud.sap/ai-feature/3fd1195b-1516-41e0-bbae-091865f28202/"
"Insights Description Generator","AI Feature","Base","SAP Signavio Process Transformation Manager","Creating clear‚ consistent‚ and business user–friendly descriptions.","Business Transformation Management","","","Generally Available","J669","https://discovery-center.cloud.sap/ai-feature/0614d66c-4e6d-42bc-b45b-135ba035d843/"
"Insights into Detailed 360 Report","AI Feature","Premium","SAP SuccessFactors Performance and Goals","Gain insights into Detailed 360 Report.","Human Capital Management","Joule Premium for Human Capital Management","","Generally Available","J577","https://discovery-center.cloud.sap/ai-feature/f6aa846b-238a-44c3-b3da-6faa76e8761b/"
"Intelligent Audit","AI Feature","Base","Concur Expense","Check expense reports to identify errors and compliance issues.","Spend Management","","","Generally Available","J841","https://discovery-center.cloud.sap/ai-feature/c75d552d-8cc5-400f-9cb3-abb470e4b560/"
"Intelligent Customer Profile","AI Feature","Premium","SAP CX AI Toolkit","Harness data from SAP CX to generate a summary that is easy to comprehend.","Customer Relationship Management","Joule Premium for Customer Experience","Joule","Generally Available","J13","https://discovery-center.cloud.sap/ai-feature/d37ca55c-2e9a-4ab6-a225-31d2f0760fd5/"
"Intelligent Filtering","AI Feature","Premium","SAP Field Service Management","Estimate the expected real duration of activities based on time efforts logged.","Supply Chain Management","","","Generally Available","J62","https://discovery-center.cloud.sap/ai-feature/cb3e2dbe-6c9a-4c22-972a-8339e0d7a06a/"
"Intelligent Invoice Error Classification","AI Feature","Base","SAP Business Network for Procurement and Supply Chain","Process rejected invoices submitted through the SAP Business Network.","Supply Chain Management","","","Generally Available","J106","https://discovery-center.cloud.sap/ai-feature/37100360-fb06-4794-9f31-abef001ccb39/"
"Intelligent Listings","AI Feature","Base","SAP Business Network for Procurement and Supply Chain","Generate product descriptions of suppliers’ catalog items.","Supply Chain Management","","","Generally Available","J66","https://discovery-center.cloud.sap/ai-feature/c70b8e5c-86a3-4819-abb2-3428ee11e0a2/"
"Intelligent Q&A","AI Feature","Premium","SAP CX AI Toolkit","Find answers to work-related questions by analyzing your company's content.","Customer Relationship Management","Joule Premium for Customer Experience","Joule","Generally Available","J14","https://discovery-center.cloud.sap/ai-feature/bbce9642-f71f-4e28-a338-11021c06c5a5/"
"International Trade Classification Agent","AI Agent","","","Save time and ensure compliance by automatically classify goods for shipping.","Financial Management","","","Beta","J648","https://discovery-center.cloud.sap/ai-feature/cb3aa823-c475-4f81-9730-d35d85bd55c7/"
"Interview Feedback Insights","AI Feature","Premium","SAP SuccessFactors Recruiting","Get insights into interviewer feedback and notes about a given candidate.","Human Capital Management","Joule Premium for Human Capital Management","","Generally Available","J270","https://discovery-center.cloud.sap/ai-feature/a3b668e4-9c02-4890-8620-1bb524c04aeb/"
"Interview Questions Generation","AI Feature","Premium","SAP SuccessFactors Recruiting","Use generative AI to provide interviewers with suggested questions.","Human Capital Management","Joule Premium for Human Capital Management","","Generally Available","J3","https://discovery-center.cloud.sap/ai-feature/e90b2438-e873-4759-a174-ffe5c950c88a/"
"Intrusion Detection","AI Feature","Base","SAP Customer Data Cloud","Prosecute malicious activity while ensuring a smooth UX for legitimate users.","Customer Relationship Management","","","Generally Available","J836","https://discovery-center.cloud.sap/ai-feature/f9052d5d-bc3e-4d0c-8525-7fe0eff2e2c3/"
"Inventory Builder","AI Feature","Premium","SAP LeanIX solutions","Upload and analyze data formats to auto-discover architectural elements.","Technology Platform","","","Generally Available","J178","https://discovery-center.cloud.sap/ai-feature/3b4cd740-d09d-4e79-9efc-69bf49221e83/"
"Inventory Prompts","AI Feature","Base","SAP LeanIX solutions","Support analyzes of IT application landscapes.","Technology Platform","","","Generally Available","J45","https://discovery-center.cloud.sap/ai-feature/e3e00a83-6fc7-4ec4-9763-5d62f942e193/"
"Invoice Capture","AI Feature","Base","Concur Invoice","Eliminate the hassle of paper invoices and speed up accounts payable processes.","Spend Management","","","Generally Available","J807","https://discovery-center.cloud.sap/ai-feature/71917827-81f0-4a94-9597-d1395486c865/"
"Issue Resolution Guidance","AI Feature","Base","SAP Quality Issue Resolution","Find similar processes using past cases and bundle them for efficiency.","Product Lifecycle Management","","","Generally Available","J956","https://discovery-center.cloud.sap/ai-feature/0555113a-ee74-45f8-8d8e-cca4ff5e737c/"
"Issue Resolution Guidance","AI Feature","Base","SAP Digital Manufacturing","Find similar processes using past cases and bundle them for efficiency.","Supply Chain Management","","","Generally Available","J957","https://discovery-center.cloud.sap/ai-feature/910ea3a0-20be-466d-8651-62147f5b0815/"
"Job Description Creation","AI Feature","Premium","SAP Fieldglass Contingent Workforce Management","Enhance job description with AI for efficiency and better candidate submissions.","Spend Management","Joule Premium for Spend Management","","Generally Available","J76","https://discovery-center.cloud.sap/ai-feature/c61dfef4-ec5c-4195-8736-116bc96c1abe/"
