Name,AI Type,Commercial Type,Product,Description,Product Category,Package,Quick Filters,Availability,Identifier,Detail Page
"Job Description Enhancement","AI Feature","Premium","SAP SuccessFactors Recruiting","Generate enhanced job descriptions using generative AI.","Human Capital Management","Joule Premium for Human Capital Management","","Generally Available","J1","https://discovery-center.cloud.sap/ai-feature/1d925a29-4254-4fcc-9726-2ade8885d242/"
"Job Description Translation","AI Feature","Premium","SAP Fieldglass Contingent Workforce Management","Simplify job requirement communication using AI-enhanced translation.","Spend Management","Joule Premium for Spend Management","","Generally Available","J75","https://discovery-center.cloud.sap/ai-feature/0f6e0fdc-de01-4ab9-9db9-702ee0a927ae/"
"Job Skills on Career Sites","AI Feature","Premium","SAP SuccessFactors Recruiting","Allows to upload a resume on career sites and receive job recommendations.","Human Capital Management","Joule Premium for Human Capital Management","","Generally Available","J773","https://discovery-center.cloud.sap/ai-feature/fda4fbef-a125-48bf-ade6-6fbf21dc91d9/"
"Joule and Microsoft 365 Copilot","AI Feature","Base","Joule","Bi-directional integration between Joule and Microsoft 365 Copilot.","Technology Platform","","Joule","Generally Available","J762","https://discovery-center.cloud.sap/ai-feature/4dfa3fea-c5d2-40e3-959d-317b07b6b64e/"
"Joule for developers‚ ABAP AI capabilities","AI Feature","Base","SAP S/4HANA Cloud Public Edition","Accelerate ABAP development with Joule.","Financial Management","","Joule","Generally Available","J792","https://discovery-center.cloud.sap/ai-feature/3c06a28b-576b-47ba-a2be-de0588391d6a/"
"Joule for developers‚ ABAP AI capabilities","AI Feature","Base","SAP S/4HANA Cloud Private Edition","Accelerate ABAP development with Joule.","Financial Management","","Joule","Generally Available","J1195","https://discovery-center.cloud.sap/ai-feature/795cf9fa-d0cc-42b0-a3d7-52e8067e847d/"
"Joule for developers‚ ABAP AI capabilities","AI Feature","Base","SAP BTP‚ ABAP environment","Accelerate ABAP development with Joule.","Technology Platform","","Joule","Generally Available","J162","https://discovery-center.cloud.sap/ai-feature/7f373198-9a41-4416-9eed-bdfca445d37a/"
"Joule Q&A","AI Feature","Base","SAP SuccessFactors solutions","Get answers about an organization’s HR policy documents.","Human Capital Management","","Joule","Generally Available","J69","https://discovery-center.cloud.sap/ai-feature/a1bff183-cd0b-4671-bf79-989b9bae42a2/"
"Joule with Concur solutions","AI Feature","Base","Concur solutions","Get smart support to minimize errors and simplify expense submission.","Spend Management","","Joule","Generally Available","J171","https://discovery-center.cloud.sap/ai-feature/d606b980-bcf2-4258-8153-f2ea05dd0730/"
"Joule with Regulatory Change Manager","AI Feature","Base","Regulatory Change Manager","Discover and evaluate regulatory updates and maintain compliance.","Technology Platform","","Joule","Generally Available","J85","https://discovery-center.cloud.sap/ai-feature/90b39e72-5dd5-4ae1-aef1-840c6e1ff6b2/"
"Joule with SAP Ariba solutions","AI Feature","Base","SAP Ariba solutions","Streamline your informational‚ navigational‚ and transactional tasks.","Spend Management","","Joule","Generally Available","J158","https://discovery-center.cloud.sap/ai-feature/4db522da-c249-46e3-9e0c-af03f663aba0/"
"Joule with SAP Asset Performance Management","AI Feature","Base","SAP Asset Performance Management","Get quick answers based on product documentation.","Supply Chain Management","","Joule","Generally Available","J107","https://discovery-center.cloud.sap/ai-feature/4bb1fe03-5a2a-419a-a224-a5b40640903d/"
"Joule with SAP Build Work Zone","AI Feature","Base","SAP Build Work Zone","Interact with SAP apps and Work Zone via natural language for instant actions.","Technology Platform","","Joule","Generally Available","J145","https://discovery-center.cloud.sap/ai-feature/8be96d98-f16d-41b4-968c-c295043c1d73/"
"Joule with SAP Business Technology Platform","AI Feature","Base","SAP Business Technology Platform","Quickly retrieve information about SAP BTP and your accounts with Joule.","Technology Platform","","Joule","Generally Available","J57","https://discovery-center.cloud.sap/ai-feature/9c079680-7938-4ddd-83c4-3d89a7943311/"
"Joule with SAP Datasphere","AI Feature","Base","SAP Datasphere","Streamline your SAP Datasphere tasks with an AI copilot.","Technology Platform","","Joule","Early Adopter Care (EAC)","J294","https://discovery-center.cloud.sap/ai-feature/a2bc2dd0-4f0b-4d82-9f94-c3baaac6c83b/"
"Joule with SAP Digital Manufacturing","AI Feature","Base","SAP Digital Manufacturing","Get quick answers based on product documentation.","Supply Chain Management","","Joule","Generally Available","J286","https://discovery-center.cloud.sap/ai-feature/edf06dbd-9d29-45b2-93d0-8399c7c34efa/"
"Joule with SAP Enterprise Service Management","AI Feature","Base","SAP Enterprise Service Management","Provide service agents instant access to customer‚ supplier‚ and employee info.","Customer Relationship Management","","Joule","Early Adopter Care (EAC)","J335","https://discovery-center.cloud.sap/ai-feature/e8539290-4654-40f0-9f33-872ed9a12649/"
"Joule with SAP Field Service Management","AI Feature","Base","SAP Field Service Management","Streamline dispatching processes with Joule.","Supply Chain Management","","Joule","Early Adopter Care (EAC)","J197","https://discovery-center.cloud.sap/ai-feature/d29fce2c-4564-49bf-b633-cbc63ee427d7/"
"Joule with SAP Fieldglass solutions","AI Feature","Base","SAP Fieldglass solutions","Enhance efficiencies across hiring processes with AI in SAP Fieldglass.","Technology Platform","","Joule","Early Adopter Care (EAC)","J257","https://discovery-center.cloud.sap/ai-feature/e52e6bbc-3b09-4a73-8829-c4ecdeff8560/"
"Joule with SAP Integrated Business Planning","AI Feature","Base","SAP Integrated Business Planning","Get quick answers based on product documentation.","Supply Chain Management","","Joule","Generally Available","J104","https://discovery-center.cloud.sap/ai-feature/7ce53ab4-0c98-44fd-9d6a-5e76fef797fc/"
"Joule with SAP Integrated Product Development","AI Feature","Base","SAP Integrated Product Development","Find and navigate to apps‚ get quick answers based on product documentation.","Product Lifecycle Management","","Joule","Generally Available","J105","https://discovery-center.cloud.sap/ai-feature/c1d90ed6-8b3d-4e77-8750-d5d15a0e7c91/"
"Joule with SAP Intelligent Clinical Supply Management","AI Feature","Base","SAP Intelligent Clinical Supply Management","Streamline navigational and informational tasks with Joule.","Supply Chain Management","","Joule","Generally Available","J332","https://discovery-center.cloud.sap/ai-feature/5bc0fbcf-4ce3-48dc-8375-8d2fdb40bc21/"
"Joule with SAP LeanIX","AI Feature","Base","SAP LeanIX solutions","Search and navigate to the right information through natural language queries.","Technology Platform","","Joule","Early Adopter Care (EAC)","J284","https://discovery-center.cloud.sap/ai-feature/afef2f21-b812-4548-ab8a-cec5f8fedb10/"
"Joule with SAP Logistics Management","AI Feature","Base","SAP Logistics Management","Simplify warehouse and transportation planning operations with natural language.","Supply Chain Management","","Joule","Generally Available","J1169","https://discovery-center.cloud.sap/ai-feature/60b3ce58-4697-4c44-a5a6-c1649dc67aff/"
"Joule with SAP Mobile Start","AI Feature","Base","SAP Mobile Start","Interact with SAP apps in natural language via a smartphone or a tablet.","Technology Platform","","Joule","Generally Available","J761","https://discovery-center.cloud.sap/ai-feature/0a10277a-3dfa-4e8d-b287-2d92a9554b54/"
"Joule with SAP Multi-Bank Connectivity","AI Feature","Base","SAP Multi-Bank Connectivity","Get quick answers about SAP Multi-Bank Connectivity from product documentation.","Financial Management","","Joule","Generally Available","J600","https://discovery-center.cloud.sap/ai-feature/5cd6a2a6-c3ba-4bf6-9111-5e2f95757a69/"
"Joule with SAP Risk and Assurance Management","AI Feature","Base","SAP Risk and Assurance Management","Joule provides intuitive navigation and access to relevant enablement content.","Financial Management","","Joule","Generally Available","J731","https://discovery-center.cloud.sap/ai-feature/42df6303-500a-46c4-93a6-ecb2d44e85dd/"
"Joule with SAP S/4HANA Cloud Private Edition","AI Feature","Base","SAP S/4HANA Cloud Private Edition","Streamline your informational‚ navigational‚ and transactional tasks.","Financial Management","","Joule","Generally Available","J54","https://discovery-center.cloud.sap/ai-feature/98ee8608-82bb-49c3-b4ca-805bd6594314/"
"Joule with SAP S/4HANA Cloud Public Edition","AI Feature","Base","SAP S/4HANA Cloud Public Edition","Streamline your informational‚ navigational‚ and transactional tasks.","Financial Management","","Joule","Generally Available","J74","https://discovery-center.cloud.sap/ai-feature/59d61974-9d59-4e32-9026-189462bbf54f/"
"Joule with SAP Sales Cloud Version 2","AI Feature","Base","SAP Sales Cloud Version 2","Enable your sales teams to win deals.","Customer Relationship Management","","Joule","Early Adopter Care (EAC)","J760","https://discovery-center.cloud.sap/ai-feature/c93d21db-bf17-402d-99a5-463865957e7f/"
"Joule with SAP Service Cloud Version 2","AI Feature","Base","SAP Service Cloud Version 2","Provide service agents instant access to customer information.","Customer Relationship Management","","Joule","Early Adopter Care (EAC)","J333","https://discovery-center.cloud.sap/ai-feature/a7284cf2-cc3a-48aa-b286-42e57b5068b4/"
"Joule with SAP Signavio solutions","AI Feature","Base","SAP Signavio solutions","Elevate your organization's process management and optimization.","Business Transformation Management","","Joule","Generally Available","J127","https://discovery-center.cloud.sap/ai-feature/c1ed93ca-2efd-4096-8300-613adf55cfef/"
"Joule with SAP SuccessFactors solutions","AI Feature","Base","SAP SuccessFactors solutions","Elevate the employee experience with an AI copilot.","Human Capital Management","","Joule","Generally Available","J19","https://discovery-center.cloud.sap/ai-feature/d513b99f-7ec5-40ba-9e8d-7d9858ba7dca/"
"Journal Upload","AI Feature","Premium","SAP S/4HANA Cloud Private Edition","Accelerate period-end journal entries.","Financial Management","Joule Premium for Financial Management","","Generally Available","J247","https://discovery-center.cloud.sap/ai-feature/be5c57fd-4b09-436f-8a63-16362fce5547/"
"Knowledge Creation Agent","AI Agent","Premium","","Create knowledge base articles based on customer tickets.","Customer Relationship Management","Joule Premium for Customer Experience","Featured","Generally Available","J938","https://discovery-center.cloud.sap/ai-feature/275ab5f1-2276-401b-bd37-6b034efde8e3/"
"Knowledge Indexing","AI Feature","Premium","SAP CX AI Toolkit","AI-powered data indexing for features and agents based on SAP CX AI Toolkit.","Customer Relationship Management","","Featured","Generally Available","J961","https://discovery-center.cloud.sap/ai-feature/f5d00884-5256-4af7-b92c-651c4419a709/"
"Lead Booster","AI Feature","Premium","SAP Sales Cloud Version 2","Increase lead generation effectiveness.","Customer Relationship Management","Joule Premium for Customer Experience","Featured","Generally Available","J6","https://discovery-center.cloud.sap/ai-feature/13f8f984-4e7d-4f29-8e10-88ec87c4ebe7/"
"Lead Intelligence","AI Feature","Base","SAP Sales Cloud Version 2","Identify open leads that have a high potential of conversion.","Customer Relationship Management","","","Generally Available","J796","https://discovery-center.cloud.sap/ai-feature/b8a09223-a2b7-48fd-ada8-430f043c2e31/"
"Lead Time Master Data Management","AI Feature","Base","SAP Integrated Business Planning","Detect and manage changes in dynamic master data‚ specifically lead time.","Supply Chain Management","","","Generally Available","J49","https://discovery-center.cloud.sap/ai-feature/00dc5f4d-fec2-49f0-baf0-8f80024550f0/"
"Machine Learning Alerts","AI Feature","Base","SAP Integrated Business Planning","Prevent supply chain issues before they happen.","Supply Chain Management","","","Generally Available","J821","https://discovery-center.cloud.sap/ai-feature/059ce559-77a9-46d7-855b-b193363ee268/"
"Machine Translation","AI Feature","Base","SAP Enterprise Service Management","Use machine translation to translate emails.","Customer Relationship Management","","","Generally Available","J813","https://discovery-center.cloud.sap/ai-feature/b42f0ef7-0fda-4615-ae3e-998bbd5e2bd1/"
"Machine Translation","AI Feature","Base","SAP Service Cloud Version 2","Use machine translation to translate emails.","Customer Relationship Management","","","Generally Available","J853","https://discovery-center.cloud.sap/ai-feature/500b5829-a388-4f10-b629-c0b0eea3820e/"
"Maintenance Order Recommendation","AI Feature","Premium","SAP S/4HANA Cloud Private Edition","Get maintenance order recommendations from historical data.","Cloud ERP applications","Joule Premium for Supply Chain Management","","Generally Available","J241","https://discovery-center.cloud.sap/ai-feature/d2a47a4f-3ea2-4f5b-9bdf-43fc2a3d95f2/"
"Maintenance Planner Agent","AI Agent","","","Avoid disruptions with real-time insights‚ smart updates‚ and planning support.","Technology Platform","","Joule","Beta","J424","https://discovery-center.cloud.sap/ai-feature/8b3daa3f-7a07-4a62-8d23-20e13d00aea4/"
"Market Dynamics Chart Plotting","AI Feature","Premium","SAP Ariba Category Management","Generate content recommendations based on AI.","Spend Management","Joule Premium for Spend Management","","Generally Available","J23","https://discovery-center.cloud.sap/ai-feature/0b25207e-a9d9-4ffc-9e33-711d7a42eabb/"
"Master Data Consistency","AI Feature","Base","SAP Integrated Business Planning","Discover patterns in your master data.","Supply Chain Management","","","Generally Available","J819","https://discovery-center.cloud.sap/ai-feature/e32a154a-933b-400c-996f-c3b823393247/"
"Master Data Governance","AI Feature","Premium","SAP S/4HANA Cloud Private Edition","Create master data change requests and generate summaries.","Financial Management","Joule Premium for Financial Management","","Generally Available","J151","https://discovery-center.cloud.sap/ai-feature/4cb78833-492a-43db-abb2-01747e7e4335/"
"Matching Improvement","AI Feature","Base","SAP Business Network for Procurement and Supply Chain","Find the best-fit suppliers based on requirements.","Supply Chain Management","","","Generally Available","J143","https://discovery-center.cloud.sap/ai-feature/bdb5f0f8-d4c9-424e-8b01-56713d44dedf/"
"Material Group Recommendations","AI Feature","Base","SAP Ariba Central Procurement","Suggest the most relevant material groups based on purchase orders.","Spend Management","","","Generally Available","J830","https://discovery-center.cloud.sap/ai-feature/6aa3651e-47b6-400b-87db-64b185fee92b/"
"Meeting Location Planner Agent","AI Agent","Base","","Helps executive assistant to organize offsite meetings.","Spend Management","","Joule","Early Adopter Care (EAC)","J326","https://discovery-center.cloud.sap/ai-feature/65b25edc-21cc-4b54-8f3c-eb4524ab3117/"
"Microsoft Teams Chat","AI Feature","Premium","SAP SuccessFactors solutions","Interact using natural language‚ get to your features and information faster.","Human Capital Management","Joule Premium for Human Capital Management","","Generally Available","J142","https://discovery-center.cloud.sap/ai-feature/0270dc31-dd49-4b30-a42a-5c6c3c16b11b/"
"Mobile Execution","AI Feature","Premium","SAP Service and Asset Manager","Voice-to-text for faster‚ accurate job reporting in the field.","Supply Chain Management","","","Generally Available","J311","https://discovery-center.cloud.sap/ai-feature/6c9a0bd1-95db-4b4c-8c12-c8c0e36898c2/"
"MRO Inventory Analysis","AI Feature","Premium","SAP Integrated Business Planning","Analyze safety stock and reorder outputs to support root cause analysis.","Supply Chain Management","Joule Premium for Supply Chain Management","","Generally Available","J1000","https://discovery-center.cloud.sap/ai-feature/5fa5aaf1-ef2b-46c9-bf8e-b0038f6c4405/"
"Natural Language Query","AI Feature","Base","SAP Analytics Cloud","Deliver tailored‚ contextual insights on user questions in natural language.","Technology Platform","","","Generally Available","J25","https://discovery-center.cloud.sap/ai-feature/6a655660-1f00-4b22-a6e4-b79167b527ec/"
"NLP Classification","AI Feature","Base","SAP Enterprise Service Management","Identify sentiment from emails.","Customer Relationship Management","","","Generally Available","J803","https://discovery-center.cloud.sap/ai-feature/7e1292bd-302d-4a6f-903d-77267cd92ec1/"
"NLP Classification","AI Feature","Base","SAP Sales Cloud Version 2","Identify sentiment from emails.","Customer Relationship Management","","","Generally Available","J797","https://discovery-center.cloud.sap/ai-feature/537d4f2d-e388-4ce0-9663-1f4d15adf235/"
"NLP Classification","AI Feature","Base","SAP Service Cloud Version 2","Identify sentiment from emails.","Customer Relationship Management","","","Generally Available","J852","https://discovery-center.cloud.sap/ai-feature/54affede-32fc-46b4-b9bf-c04eb12d341d/"
"Note Corrections for Project Billing","AI Feature","Premium","SAP S/4HANA Cloud Public Edition","Propose grammatically correct notes for project billing request items.","Financial Management","Joule Premium for Financial Management","","Generally Available","J346","https://discovery-center.cloud.sap/ai-feature/cab0dc5c-6c85-4d8e-963a-cad7a64e012a/"
"O*NET Labelling","AI Feature","Base","SAP Fieldglass Contingent Workforce Management","Recommend O*NET codes for job classifications.","Spend Management","","","Generally Available","J845","https://discovery-center.cloud.sap/ai-feature/91ab4a9a-a6ec-4b3a-a06d-7e530af84f2c/"
"Optimal Order Quantities","AI Feature","Base","SAP Predictive Replenishment","Optimize order quantities for groups of products according to objectives.","Supply Chain Management","","","Generally Available","J834","https://discovery-center.cloud.sap/ai-feature/114a2d42-80fc-4fa3-bf8c-b405dc81d9ab/"
"Outlier Job Detection","AI Feature","Base","SAP Integrated Business Planning","Detect jobs that are taking longer or shorter than expected.","Supply Chain Management","","","Generally Available","J820","https://discovery-center.cloud.sap/ai-feature/708721ca-6e0f-472c-9bee-21bb3bb03a1b/"
"Payment Exception Analysis","AI Feature","","SAP S/4HANA Cloud Public Edition","Analyze payment exceptions and discover recommended resolutions.","Financial Management","","","Beta","J375","https://discovery-center.cloud.sap/ai-feature/016c719c-5363-47ff-945f-cdddd5241871/"
"Performance Goal Creation","AI Feature","Premium","SAP SuccessFactors Performance and Goals","Build meaningful and inspiring performance goals.","Human Capital Management","Joule Premium for Human Capital Management","","Generally Available","J38","https://discovery-center.cloud.sap/ai-feature/231d6a91-c550-4bca-8de7-b903cb7e7f5b/"
"Performance Indicators Recommender","AI Feature","Premium","SAP Signavio solutions","Discover metrics relevant for your business.","Business Transformation Management","","Joule","Generally Available","J120","https://discovery-center.cloud.sap/ai-feature/4be4b091-a23d-4f59-975e-65cb6a4a8fc5/"
"Performance Insights","AI Feature","Premium","SAP SuccessFactors Performance and Goals","Get insights on an employee's performance based on the feedback received.","Human Capital Management","Joule Premium for Human Capital Management","","Generally Available","J272","https://discovery-center.cloud.sap/ai-feature/3724bee9-7e25-4416-b9c9-b03cbb37d7b6/"
"Performance Preparation Agent","AI Agent","Base","","Provide managers data-driven insights before 1:1 with employees.","Human Capital Management","","Joule","Generally Available","J671","https://discovery-center.cloud.sap/ai-feature/761a2305-b0a2-4262-b9a3-abd4945ad314/"
"Permit Management","AI Feature","","SAP S/4HANA Cloud Public Edition","Automatically extract and setup permit data from document.","Cloud ERP applications","","Featured","Beta","J344","https://discovery-center.cloud.sap/ai-feature/89944fea-d96d-453c-9684-fe2b2c9cbb51/"
"Person Insights for Compensation Discussions","AI Feature","Premium","SAP SuccessFactors Employee Central","Generate insights into an employee's compensation.","Human Capital Management","Joule Premium for Human Capital Management","Joule","Generally Available","J40","https://discovery-center.cloud.sap/ai-feature/48c886ad-45f2-4263-a249-2584c2b5a877/"
"Personalization Rules","AI Feature","Base","SAP Engagement Cloud","Tailor the recommended product set to your business needs.","Customer Relationship Management","","","Generally Available","J838","https://discovery-center.cloud.sap/ai-feature/5860e88c-cf84-4552-94aa-dc1756ddc995/"
"Personalized Learning Recommendations","AI Feature","Base","SAP SuccessFactors Learning","Get personalized AI-driven learning recommendations based on skills and role.","Human Capital Management","","","Generally Available","J1279","https://discovery-center.cloud.sap/ai-feature/9e0871fa-e745-4aba-89b0-5b7b3699fb32/"
"Personalized Opportunities Recommendations","AI Feature","Base","SAP SuccessFactors Career and Talent Development","Improve assignment and open job recommendations.","Human Capital Management","","","Generally Available","J996","https://discovery-center.cloud.sap/ai-feature/89c64e94-9341-4fc2-8f8b-1c05c19cc0f8/"
"Personalized Search","AI Feature","Base","Intelligent Selling Services for SAP Commerce Cloud","Displays search results with products tailored to users’ interests.","Customer Relationship Management","","","Generally Available","J922","https://discovery-center.cloud.sap/ai-feature/7d8e2b6c-cc25-466c-9037-ee756ce90bd8/"
"Policy Assistance","AI Feature","Base","Concur Expense","Boost policy awareness and drive compliance with AI-generated policy trip tips.","Spend Management","","","Early Adopter Care (EAC)","J454","https://discovery-center.cloud.sap/ai-feature/6e510fad-120e-4b9a-9eb1-e1cfb5352436/"
"Popular Items","AI Feature","Base","SAP Ariba Buying","Discover popular items in your company's catalog.","Spend Management","","","Generally Available","J809","https://discovery-center.cloud.sap/ai-feature/60dc710e-feb8-44ce-9f05-c3f5d999fbb0/"
"Posting Issue Handling for Billing Documents","AI Feature","Base","SAP S/4HANA Cloud Public Edition","Assist billing clerks to efficiently process billing docs with posting issues.","Financial Management","","Joule","Generally Available","J355","https://discovery-center.cloud.sap/ai-feature/f558354e-8de3-4b95-ae75-4cc5055cf911/"
"Predictive Labor Demand Planning","AI Feature","Base","SAP Extended Warehouse Management","Predict planned workload data based on picking and packing outbound processes.","Cloud ERP applications","","","Generally Available","J237","https://discovery-center.cloud.sap/ai-feature/9deeeefb-fd9f-422f-9fbe-e236f2e53cad/"
"Predictive Planning","AI Feature","Base","SAP Analytics Cloud","Predictive planning creates accurate forecasts to speed up planning activities.","Technology Platform","","","Generally Available","J894","https://discovery-center.cloud.sap/ai-feature/07cbfbe5-5fec-4f2f-9e5b-8a7c2dfd6d74/"
"Predictive Routing","AI Feature","Base","SAP Field Service Management","Predict realistic driving distances and times.","Supply Chain Management","","","Generally Available","J828","https://discovery-center.cloud.sap/ai-feature/3f5f1534-0869-43e4-93ae-e60814d380fa/"
"Predictive Subject Dynamics","AI Feature","Base","SAP Intelligent Clinical Supply Management","Predict patient enrollment and dropouts for accurate clinical supply planning.","Supply Chain Management","","","Generally Available","J328","https://discovery-center.cloud.sap/ai-feature/bbec33b6-b688-4ccd-8bb2-cbc6631e83e8/"
"Problem Report Creation","AI Feature","Base","SAP Integrated Product Development","Enable engineers to create structured maintenance reports in natural language.","Supply Chain Management","","Joule","Generally Available","J1314","https://discovery-center.cloud.sap/ai-feature/971035b1-d2a3-4644-8e3a-9ebc79e2dbd2/"
"Process Analyzer‚ Automated Mapping","AI Feature","","SAP Signavio Process Intelligence","Map various inputs based on their context.","Technology Platform","","","Beta","J1122","https://discovery-center.cloud.sap/ai-feature/6c6eb8d1-764c-4727-b8d5-4911607f89b8/"
"Process Analyzer‚ Text to Insight","AI Feature","Base","SAP Signavio solutions","Prompt to discover insights from your data.","Business Transformation Management","","","Generally Available","J112","https://discovery-center.cloud.sap/ai-feature/a6dde1d9-6da4-443f-874a-e6eb183e2bd5/"
"Process Analyzer‚ Text To Widget","AI Feature","Base","SAP Signavio solutions","Generate dashboard widgets with natural language queries.","Business Transformation Management","","","Generally Available","J212","https://discovery-center.cloud.sap/ai-feature/6d74c5e9-32c1-443c-be23-c7ebbc51d573/"
"Process Content Recommender Agent","AI Agent","","","Intelligently recommends relevant process content in SAP Signavio.","Business Transformation Management","","Joule","Beta","J940","https://discovery-center.cloud.sap/ai-feature/aa94ac46-bbb3-405e-a7f9-1e14e9bc16db/"
"Process Editing","AI Feature","Base","SAP Build Process Automation","Support process design with natural language editing for automation artifacts.","Technology Platform","","","Generally Available","J639","https://discovery-center.cloud.sap/ai-feature/143f1e51-609a-45d9-ab96-bf286e044a03/"
